mysql> create table student(usn varchar(10)
    -> primary key not null,
    -> name varchar(20) not null,
    -> D0B date not null,
    -> branch varchar(10) not null,
    -> mark1 int(3),
    -> mark2 int(3),
    -> mark3 int(3),
    -> total int(3),
    -> GPA decimal(3,2));
Query OK, 0 rows affected, 4 warnings (0.02 sec)

mysql> desc student;
+--------+--------------+------+-----+---------+-------+
| Field  | Type         | Null | Key | Default | Extra |
+--------+--------------+------+-----+---------+-------+
| usn    | varchar(10)  | NO   | PRI | NULL    |       |
| name   | varchar(20)  | NO   |     | NULL    |       |
| D0B    | date         | NO   |     | NULL    |       |
| branch | varchar(10)  | NO   |     | NULL    |       |
| mark1  | int          | YES  |     | NULL    |       |
| mark2  | int          | YES  |     | NULL    |       |
| mark3  | int          | YES  |     | NULL    |       |
| total  | int          | YES  |     | NULL    |       |
| GPA    | decimal(3,2) | YES  |     | NULL    |       |
+--------+--------------+------+-----+---------+-------+
9 rows in set (0.00 sec)

mysql> insert into student(usn,name,D0B,branch) values("4VP21MC033","Rashmi","2001-04-08","MCA");
Query OK, 1 row affected (0.01 sec)

mysql> insert into student(usn,name,D0B,branch) values("4VP21MC045","Shruthi","2001-05-04","MCA");
Query OK, 1 row affected (0.01 sec)

mysql> insert into student(usn,name,D0B,branch) values("4VP21MC030","Puneeth","2000-06-11","MBA");
Query OK, 1 row affected (0.01 sec)

mysql> insert into student(usn,name,D0B,branch) values("4VP21MC028","Prathiksha","1999-07-10","MBA");
Query OK, 1 row affected (0.01 sec)

mysql> insert into student(usn,name,D0B,branch) values("4VP21MC014","Geethanjali","2001-03-21","MCA");
Query OK, 1 row affected (0.01 sec)

mysql> select * from student;
+------------+-------------+------------+--------+-------+-------+-------+-------+------+
| usn        | name        | D0B        | branch | mark1 | mark2 | mark3 | total | GPA  |
+------------+-------------+------------+--------+-------+-------+-------+-------+------+
| 4VP21MC014 | Geethanjali | 2001-03-21 | MCA    |  NULL |  NULL |  NULL |  NULL | NULL |
| 4VP21MC028 | Prathiksha  | 1999-07-10 | MBA    |  NULL |  NULL |  NULL |  NULL | NULL |
| 4VP21MC030 | Puneeth     | 2000-06-11 | MBA    |  NULL |  NULL |  NULL |  NULL | NULL |
| 4VP21MC033 | Rashmi      | 2001-04-08 | MCA    |  NULL |  NULL |  NULL |  NULL | NULL |
| 4VP21MC045 | Shruthi     | 2001-05-04 | MCA    |  NULL |  NULL |  NULL |  NULL | NULL |
+------------+-------------+------------+--------+-------+-------+-------+-------+------+
5 rows in set (0.00 sec)


iii. Find the students who born on a particular year of birth from the date_of_birth column.

mysql> select name from student where year(D0B)="1999";
+------------+
| name       |
+------------+
| Prathiksha |
+------------+
1 row in set (0.00 sec)

mysql> update student set mark1="70",mark2="80",mark3="28" where USN="4VP21MC014";
Query OK, 1 row affected (0.00 sec)
Rows matched: 1  Changed: 1  Warnings: 0

mysql> update student set mark1="45",mark2="60",mark3="99" where USN="4VP21MC028";
Query OK, 1 row affected (0.00 sec)
Rows matched: 1  Changed: 1  Warnings: 0

mysql> update student set mark1="55",mark2="60",mark3="99" where USN="4VP21MC030";
Query OK, 1 row affected (0.01 sec)
Rows matched: 1  Changed: 1  Warnings: 0

mysql> update student set mark1="90",mark2="89",mark3="79" where USN="4VP21MC033";
Query OK, 1 row affected (0.01 sec)
Rows matched: 1  Changed: 1  Warnings: 0

mysql> select * from student;
+------------+-------------+------------+--------+-------+-------+-------+-------+------+
| usn        | name        | D0B        | branch | mark1 | mark2 | mark3 | total | GPA  |
+------------+-------------+------------+--------+-------+-------+-------+-------+------+
| 4VP21MC014 | Geethanjali | 2001-03-21 | MCA    |    70 |    80 |    28 |  NULL | NULL |
| 4VP21MC028 | Prathiksha  | 1999-07-10 | MBA    |    45 |    60 |    99 |  NULL | NULL |
| 4VP21MC030 | Puneeth     | 2000-06-11 | MBA    |    55 |    60 |    99 |  NULL | NULL |
| 4VP21MC033 | Rashmi      | 2001-04-08 | MCA    |    90 |    89 |    79 |  NULL | NULL |
| 4VP21MC045 | Shruthi     | 2001-05-04 | MCA    |    90 |    70 |    90 |  NULL | NULL |
+------------+-------------+------------+--------+-------+-------+-------+-------+------+
5 rows in set (0.01 sec)

mysql> update student set total=mark1+mark2+mark3;
Query OK, 5 rows affected (0.01 sec)
Rows matched: 5  Changed: 5  Warnings: 0

mysql> select * from student;
+------------+-------------+------------+--------+-------+-------+-------+-------+------+
| usn        | name        | D0B        | branch | mark1 | mark2 | mark3 | total | GPA  |
+------------+-------------+------------+--------+-------+-------+-------+-------+------+
| 4VP21MC014 | Geethanjali | 2001-03-21 | MCA    |    70 |    80 |    28 |   178 | NULL |
| 4VP21MC028 | Prathiksha  | 1999-07-10 | MBA    |    45 |    60 |    99 |   204 | NULL |
| 4VP21MC030 | Puneeth     | 2000-06-11 | MBA    |    55 |    60 |    99 |   214 | NULL |
| 4VP21MC033 | Rashmi      | 2001-04-08 | MCA    |    90 |    89 |    79 |   258 | NULL |
| 4VP21MC045 | Shruthi     | 2001-05-04 | MCA    |    90 |    70 |    90 |   250 | NULL |
+------------+-------------+------------+--------+-------+-------+-------+-------+------+
5 rows in set (0.00 sec)

mysql> update student set GPA=total/3;
ERROR 1264 (22003): Out of range value for column 'GPA' at row 1
mysql> alter table student modify column GPA Float;
Query OK, 5 rows affected (0.04 sec)
Records: 5  Duplicates: 0  Warnings: 0

mysql> update student set GPA=total/3;
Query OK, 5 rows affected (0.01 sec)
Rows matched: 5  Changed: 5  Warnings: 0

mysql> select * from student;
+------------+-------------+------------+--------+-------+-------+-------+-------+---------+
| usn        | name        | D0B        | branch | mark1 | mark2 | mark3 | total | GPA     |
+------------+-------------+------------+--------+-------+-------+-------+-------+---------+
| 4VP21MC014 | Geethanjali | 2001-03-21 | MCA    |    70 |    80 |    28 |   178 | 59.3333 |
| 4VP21MC028 | Prathiksha  | 1999-07-10 | MBA    |    45 |    60 |    99 |   204 |      68 |
| 4VP21MC030 | Puneeth     | 2000-06-11 | MBA    |    55 |    60 |    99 |   214 | 71.3333 |
| 4VP21MC033 | Rashmi      | 2001-04-08 | MCA    |    90 |    89 |    79 |   258 |      86 |
| 4VP21MC045 | Shruthi     | 2001-05-04 | MCA    |    90 |    70 |    90 |   250 | 83.3333 |
+------------+-------------+------------+--------+-------+-------+-------+-------+---------+
5 rows in set (0.00 sec)
mysql> select * from student where Branch="MCA";
+------------+-------------+------------+--------+-------+-------+-------+-------+---------+
| usn        | name        | D0B        | branch | mark1 | mark2 | mark3 | total | GPA     |
+------------+-------------+------------+--------+-------+-------+-------+-------+---------+
| 4VP21MC014 | Geethanjali | 2001-03-21 | MCA    |    70 |    80 |    28 |   178 | 59.3333 |
| 4VP21MC033 | Rashmi      | 2001-04-08 | MCA    |    90 |    89 |    79 |   258 |      86 |
| 4VP21MC045 | Shruthi     | 2001-05-04 | MCA    |    90 |    70 |    90 |   250 | 83.3333 |
+------------+-------------+------------+--------+-------+-------+-------+-------+---------+
3 rows in set (0.00 sec)

select max(GPA),branch from student group by branch;
+----------+--------+
| max(GPA) | branch |
+----------+--------+
|       86 | MCA    |
|  71.3333 | MBA    |
+----------+--------+

mysql> select name from student where name like "S%";
+---------+
| name    |
+---------+
| Shruthi |
+---------+

mysql> select name from student where name like "%ha";
+------------+
| name       |
+------------+
| Prathiksha |
+------------+

delete from student where USN="4VP21MC014";
Query OK, 1 row affected (0.00 sec)

mysql> select * from student;
+------------+------------+------------+--------+-------+-------+-------+-------+---------+
| usn        | name       | D0B        | branch | mark1 | mark2 | mark3 | total | GPA     |
+------------+------------+------------+--------+-------+-------+-------+-------+---------+
| 4VP21MC028 | Prathiksha | 1999-07-10 | MBA    |    45 |    60 |    99 |   204 |      68 |
| 4VP21MC030 | Puneeth    | 2000-06-11 | MBA    |    55 |    60 |    99 |   214 | 71.3333 |
| 4VP21MC033 | Rashmi     | 2001-04-08 | MCA    |    90 |    89 |    79 |   258 |      86 |
| 4VP21MC045 | Shruthi    | 2001-05-04 | MCA    |    90 |    70 |    90 |   250 | 83.3333 |
+------------+------------+------------+--------+-------+-------+-------+-------+---------+

