create database VP21MC033_sports;
mysql> show databases
    -> ;
+--------------------+
| Database           |
+--------------------+
| VP21MC033_college  |
| VP21MC033_sports   |
| information_schema |
+--------------------+

use VP21MC033_sports;
Database changed

create table team(TID varchar(20) primary key not null,
    -> Tname varchar(20) not null,
    -> Coach varchar(20) not null,
    -> CaptainId varchar(20) not null,
    -> city varchar(20) not null);
Query OK, 0 rows affected (0.02 sec)

mysql> desc team;
+-----------+-------------+------+-----+---------+-------+
| Field     | Type        | Null | Key | Default | Extra |
+-----------+-------------+------+-----+---------+-------+
| TID       | varchar(20) | NO   | PRI | NULL    |       |
| Tname     | varchar(20) | NO   |     | NULL    |       |
| Coach     | varchar(20) | NO   |     | NULL    |       |
| CaptainId | varchar(20) | NO   |     | NULL    |       |
| city      | varchar(20) | NO   |     | NULL    |       |
+-----------+-------------+------+-----+---------+-------+

mysql> create table player(PID varchar(10) primary key not null,
    -> Pname varchar(20) not null,
    -> age int(2) not null,
    -> TID varchar(20),foreign key(TID) references team(TID));
Query OK, 0 rows affected, 1 warning (0.03 sec)

mysql> desc player;
+-------+-------------+------+-----+---------+-------+
| Field | Type        | Null | Key | Default | Extra |
+-------+-------------+------+-----+---------+-------+
| PID   | varchar(10) | NO   | PRI | NULL    |       |
| Pname | varchar(20) | NO   |     | NULL    |       |
| age   | int         | NO   |     | NULL    |       |
| TID   | varchar(20) | YES  | MUL | NULL    |       |
+-------+-------------+------+-----+---------+-------+

mysql> create table stadium(SID varchar(10) primary key not null,
    -> Sname varchar(20) not null,pincode int(6) not null,
    -> city varchar(20) not null,
    -> area varchar(10) not null);
Query OK, 0 rows affected, 1 warning (0.03 sec)

mysql> desc stadium;
+---------+-------------+------+-----+---------+-------+
| Field   | Type        | Null | Key | Default | Extra |
+---------+-------------+------+-----+---------+-------+
| SID     | varchar(10) | NO   | PRI | NULL    |       |
| Sname   | varchar(20) | NO   |     | NULL    |       |
| pincode | int         | NO   |     | NULL    |       |
| city    | varchar(20) | NO   |     | NULL    |       |
| area    | varchar(10) | NO   |     | NULL    |       |
+---------+-------------+------+-----+---------+-------+

mysql> create table matches(MID varchar(20) primary key not null, 
Mdate date, 
time time, 
SID varchar(20),foreign key(SID)references stadium(SID), 
team1id varchar(20),foreign key(team1id)references team(TID), 
team2id varchar(20),foreign key(team2id)references team(TID),
winningteamid varchar(20),foreign key(winningteamid)references team(TID),  
manofthematch varchar(20),foreign key(manofthematch)references player(PID));
Query OK, 0 rows affected (0.04 sec)

mysql> desc matches;
+---------------+-------------+------+-----+---------+-------+
| Field         | Type        | Null | Key | Default | Extra |
+---------------+-------------+------+-----+---------+-------+
| MID           | varchar(20) | NO   | PRI | NULL    |       |
| Mdate         | date        | YES  |     | NULL    |       |
| time          | time        | YES  |     | NULL    |       |
| SID           | varchar(20) | YES  | MUL | NULL    |       |
| team1id       | varchar(20) | YES  | MUL | NULL    |       |
| team2id       | varchar(20) | YES  | MUL | NULL    |       |
| winningteamid | varchar(20) | YES  | MUL | NULL    |       |
| manofthematch | varchar(20) | YES  | MUL | NULL    |       |
+---------------+-------------+------+-----+---------+-------+

 create table playerphone(PID varchar(20),foreign key(PID)references player(PID),
    -> phone varchar(10) primary key not null);

desc playerphone;
+-------+-------------+------+-----+---------+-------+
| Field | Type        | Null | Key | Default | Extra |
+-------+-------------+------+-----+---------+-------+
| PID   | varchar(20) | YES  | MUL | NULL    |       |
| phone | varchar(10) | NO   | PRI | NULL    |       |
+-------+-------------+------+-----+---------+-------+

alter table team add foreign key(CaptainId)references player(PID);

mysql> insert into stadium values('111','chinaswamy',56001,'bangalore','mgroad');
Query OK, 1 row affected (0.01 sec)

mysql> insert into stadium values('222','kotla',56001,'dehli','highway');
Query OK, 1 row affected (0.00 sec)

mysql> insert into stadium values('333','international',88801,'chennai','tr nagar');
Query OK, 1 row affected (0.01 sec)

mysql> insert into stadium values('444','ksca',56098,'bangalore','peenya');
Query OK, 1 row affected (0.01 sec)

mysql> insert into stadium values('555','csca',609035,'coachin','beach road');
Query OK, 1 row affected (0.00 sec)

mysql> select * from stadium;
+-----+---------------+---------+-----------+------------+
| SID | Sname         | pincode | city      | area       |
+-----+---------------+---------+-----------+------------+
| 111 | chinaswamy    |   56001 | bangalore | mgroad     |
| 222 | kotla         |   56001 | dehli     | highway    |
| 333 | international |   88801 | chennai   | tr nagar   |
| 444 | ksca          |   56098 | bangalore | peenya     |
| 555 | csca          |  609035 | coachin   | beach road |
+-----+---------------+---------+-----------+------------+

mysql> insert into player values('1','sachin',33,'123');
Query OK, 1 row affected (0.00 sec)

mysql> insert into player values('2','dravid',32,'124');
Query OK, 1 row affected (0.01 sec)

mysql> insert into player values('3','dhoni',30,'124');
Query OK, 1 row affected (0.00 sec)

mysql> insert into player values('4','raina',30,'125');
Query OK, 1 row affected (0.01 sec)

mysql> insert into player values('5','kohli',23,'126');
Query OK, 1 row affected (0.00 sec)

mysql> select * from player;
+-----+--------+-----+------+
| PID | Pname  | age | TID  |
+-----+--------+-----+------+
| 1   | sachin |  33 | 123  |
| 2   | dravid |  32 | 124  |
| 3   | dhoni  |  30 | 124  |
| 4   | raina  |  30 | 125  |
| 5   | kohli  |  23 | 126  |
+-----+--------+-----+------+
5 rows in set (0.00 sec)

mysql> insert into values('101','2010-01-17','10','111','123','124','123','1');
ERROR 1064 (42000): You have an error in your SQL syntax; check the manual that corresponds to your MySQL server version for the right syntax to use near 'values('101','2010-01-17','10','111','123','124','123','1')' at line 1
mysql> insert into matches values('101','2010-01-17','10','111','123','124','123','1');
Query OK, 1 row affected (0.01 sec)

mysql> insert into matches values('101','2010-01-17','10','222','124','126','126','5');
ERROR 1062 (23000): Duplicate entry '101' for key 'matches.PRIMARY'
mysql> insert into matches values('102','2010-01-17','10','222','124','126','126','5');
Query OK, 1 row affected (0.01 sec)

mysql> insert into matches values('103','2012-07-18','11','111','125','126','126','5');
Query OK, 1 row affected (0.01 sec)

mysql> insert into matches values('104','2015-06-17','2','111','125','123','123','1');
Query OK, 1 row affected (0.00 sec)

mysql> select * from matches;
+-----+------------+----------+------+---------+---------+---------------+---------------+
| MID | Mdate      | time     | SID  | team1id | team2id | winningteamid | manofthematch |
+-----+------------+----------+------+---------+---------+---------------+---------------+
| 101 | 2010-01-17 | 00:00:10 | 111  | 123     | 124     | 123           | 1             |
| 102 | 2010-01-17 | 00:00:10 | 222  | 124     | 126     | 126           | 5             |
| 103 | 2012-07-18 | 00:00:11 | 111  | 125     | 126     | 126           | 5             |
| 104 | 2015-06-17 | 00:00:02 | 111  | 125     | 123     | 123           | 1             |
+-----+------------+----------+------+---------+---------+---------------+---------------+

insert into playerphone values("1","9087657443");
Query OK, 1 row affected (0.01 sec)

mysql> insert into playerphone values("1","9987632100");
Query OK, 1 row affected (0.01 sec)

mysql> insert into playerphone values("2","9987632100");
ERROR 1062 (23000): Duplicate entry '9987632100' for key 'playerphone.PRIMARY'
mysql> insert into playerphone values("2","9987632101");
Query OK, 1 row affected (0.00 sec)

mysql> insert into playerphone values("3","9945672101");
Query OK, 1 row affected (0.00 sec)

mysql> select * from playerphone;
+------+------------+
| PID  | phone      |
+------+------------+
| 1    | 9087657443 |
| 1    | 9987632100 |
| 2    | 9987632101 |
| 3    | 9945672101 |
+------+------------+
4 rows in set (0.00 sec)

mysql> select Pname,Tname,age from player p,team t where p.TID=t.TID and age in (select min(age) from player);
+-------+-----------+-----+
| Pname | Tname     | age |
+-------+-----------+-----+
| kohli | derdevils |  23 |
+-------+-----------+-----+

select Sname from stadium  where SID=(select SID from matches  group by SID order by count(*) desc limit 1);
+------------+
| Sname      |
+------------+
| chinaswamy |
+------------+
mysql> select*from stadium  where SID=(select SID from matches  group by SID order by count(*) desc limit 1);
+-----+------------+---------+-----------+--------+
| SID | Sname      | pincode | city      | area   |
+-----+------------+---------+-----------+--------+
| 111 | chinaswamy |   56001 | bangalore | mgroad |
+-----+------------+---------+-----------+--------+
1 row in set (0.00 sec)
update team set CaptainId=2 where TID=123;
Query OK, 1 row affected (0.00 sec)
Rows matched: 1  Changed: 1  Warnings: 0

mysql> update team set CaptainId=3 where TID=124;
Query OK, 1 row affected (0.01 sec)
Rows matched: 1  Changed: 1  Warnings: 0

mysql> update team set CaptainId=5 where TID=125;
Query OK, 1 row affected (0.01 sec)
Rows matched: 1  Changed: 1  Warnings: 0

mysql> update team set CaptainId=4 where TID=126;
Query OK, 1 row affected (0.01 sec)
Rows matched: 1  Changed: 1  Warnings: 0

select * from team;
+-----+-----------+--------+-----------+-----------+
| TID | Tname     | Coach  | CaptainId | city      |
+-----+-----------+--------+-----------+-----------+
| 123 | rcb       | sunil  | 2         | Bangalore |
| 124 | csk       | laxman | 3         | Chenai    |
| 125 | royals    | singh  | 5         | rajastan  |
| 126 | derdevils | sehwag | 4         | dehli     |
+-----+-----------+--------+-----------+-----------+

select * from player
    -> where PID not in (select CaptainId from team)
    -> and PID in(select manofthematch from matches group by manofthematch having count(*)>=2);
    
+-----+--------+-----+------+
| PID | Pname  | age | TID  |
+-----+--------+-----+------+
| 1   | sachin |  33 | 123  |
+-----+--------+-----+------+
1 row in set (0.00 sec)



mysql> select * from team where TID =(select winningteamid from matches group by(winningteamid) order by (winningteamid) desc limit 1);
+-----+-----------+--------+-----------+-------+
| TID | Tname     | Coach  | CaptainId | city  |
+-----+-----------+--------+-----------+-------+
| 126 | derdevils | sehwag | 4         | dehli |
+-----+-----------+--------+-----------+-------+
1 row in set (0.00 sec)





